,jobtitle,jobdescription,experience
0,Lecturer In Discipline | Data Science,"<p>The Department of Computer Science at Columbia University in the New York City invites applications for Lecturer in Discipline in the area of Data Science. <br /> <br />Lecturers in Discipline are officers who meet a programmatic need for instruction in specialized fields. The selected candidate/s will be expected to teach courses on Algorithms, Machine Learning, as well as the Capstone & Ethics course. Courses will be geared towards data science, at the graduate level, and the candidate/s will be responsible for advising students in Data Science Institute's academic programs: Certification of Professional Achievement and/or Master of Science in Data Science. In addition to teaching and mentoring responsibilities, the selected candidate will assist the growth and development of future online and on-campus graduate degree programs within the Institute, as well as with executive education; ensure adequate linkage with industry and practical applications as part of the Capstone & Ethics course; and coordinating with the faculty in the Data Science Institute. Typical teaching load consists of two courses per semester.</p> <p>Candidates for appointment must demonstrate practice expertise, professional competence and scholarship in Computer Science. Candidates must hold a doctorate degree or its professional equivalent. The ideal candidate also possesses the ability to bring real world approaches, methods and technologies from industry to the School's classrooms. In collaboration with the Institute's Director of Strategic Programs, the incumbent will provide students with exposure to practitioners of outstanding professional achievement and leadership. The Department is especially interested in qualified candidates who can contribute, through their teaching and/or service, to the diversity and excellence of the academic community.  </p> <p>Lecturers in Discipline will be appointed for an initial year, after which, appointments will be renewed annually, based on his/her performance.  </p>",No experience
1,Data Scientist / Management Analyst,"ENGINEERING: 
	H2O.ai, Inc. requires a Data Scientist / Management Analyst in Mountain View, CA. Duties: Predict risk by analyzing consumer spending transactional data using statistical techniques such as decision trees & neural networks. Please email resumes to careers@h2o.ai. Must reference job code 151124.",No experience
2,Data Scientist,"Research Associate (Research Institute at Nationwide Children's Hospital, Columbus, OH). Perform advanced statistical analyses. Execute simulation-based analyses to evaluate performance of alternative data linkage models. Teach in-house stats & research seminars. Must have MS in Biostats or Stats or related & 1 year (PT or FT; gained before/during/after degree) in academic or research setting in analyzing data utilizing advanced stat. methods, such as logistic regression, using SAS, conducting research projects & preparing summary reports, manuscripts, or presentations, & effective undergrad- or grad-level teaching that demonstrates students' understanding & advancement in subject matter knowledge, as confirmed by references. Qualified candidates may view details & apply online at www.nationwidechildrens.org",No experience
3,Data Scientist,"<p>Data Scientist sought by zulily, LLC. in Seattle, WA. Bld cmplx statstcl mdls tht lrn frm &amp; scale to terabytes of data usng lang such as R, Python, Julia, etc. Wrt &amp; intrprt cmplx SQL and HiveQL queries to infrm data mnng &amp; mdlng. Reqs MS in Stats, Math, Engrng, Op Rsrch, Comp Sci or rltd. Know of fclty lctn, Geo-Anlytcl &amp; Map vislztn; systms mdlng, optmzton, frght dmnd frcstng and ops mngmnt; ntwrk flw optmzton, trnsprtn, lgstcs &amp; cst mdlng. Prfcncy w advncd prgrmmng lang such as Matlab, R, Python &amp; othr sftwre TransCAD, ArcGIS etc; in answrng cmplx biz qstns usng optmztn &amp; stats. Req trvl to compny &amp; client sites as nedd. Perm US wrk auth reqd. Aply @ jobpostingtoday.com&nbsp; ref# 84255.</p>",No experience
4,Tech Data Scientist,"Tech Data Scientist sought by Zulily in Seattle, WA. MS in Stats, Math, Engrng, Oprtns Rsrch, Comp Sci, or anthr quntiv dscp. Knowl of: predctv modlg usng bth sprvsd & unsprvsd lrng techqs; . Knowl in: gnrlzd linr modls, ensmbl modls, resmplg mthds, modl validtn & testg, dimsnlty rdcn, clstng & Bayesian aprch to data anlys; knowl of at least 1 of R or Python; bsic anlys tools of SQL & Excel; ansring cmplx biz qstns usng stats, mach lrnng & matrx algbra; comnctng modeling procs & rslts to non-exprts; stats & prbblty, mach lrnng & wrkng w/ lrg data sets. Req ocsnl dmstc trvl to oth zulily offcs. PERM US wrk authy. Aply @ www.jobpostingtoday.com # 83722",No experience
5,Data Engineer Lead,"The Lead Data Engineer is responsible for building a data processing pipeline in that collects, connects, centralizes, and curates data from various internal and external data sources. This role is pivotal to the mission and vision of Enterprise Analytics to transform healthcare for children. You must be able to architect highly scalable and reliable data engineering solutions for moving data efficiently across systems; design, implement, test and deploy data processing infrastructure; take ownership and get things done in an Agile team setting; and break down, estimate and provide just-in-time design for small increments of work.",No experience
6,Data Engineer Lead,"<font size=""2""><font face=""arial,helvetica,sans-serif""><strong>We are using data to transform care and cures for kids!<br></strong><br>For more than 100 years, Seattle Children's has been leading the discovery of new cures and delivering the latest treatments available - all part of our mission to prevent, treat, and eliminate pediatric disease. We are now taking it to the next level and experiencing unprecedented growth in data and analytics across the enterprise. We're looking for talented data/analytic experts with a passion for helping kids and their families lead better, healthier lives.<br><br>Seattle Children's Enterprise Analytics (SCEA) is the analytic backbone supporting clinicians, research, and business operations. From the simplest data mart to real-time streaming for predictive analytics, we deliver data and analytics to our world-class researchers and clinicians that they need to make timely, data-driven decisions - decisions that will transform medical care and cures for kids worldwide for decades to come. <br><br></font></font><font face=""arial,helvetica,sans-serif"" size=""2"">As a Lead Engineer in SCEA, you will work with developers, analysts, scientists, clinicians, and business owners in a team-driven, agile environment to develop and scale data products covering more than half a million patients. We need your experience and expertise to build innovative solutions to transform patient care. Successful members of this team collaborate effectively with internal end-users, aggressive cross-functional development teams, and technical support/sustaining engineering teams to solve problems, implement next generation solutions and deliver successfully against high operational standards of system availability and reliability. We look for team members who are excellent communicators, self-motivated, flexible, hard working, and who like to have fun.<br><br><br></font><font size=""2""><font face=""arial,helvetica,sans-serif""><strong><u>Job Summary</u><br></strong><br>The Lead Data Engineer is responsible for building a data processing pipeline in that collects, connects, centralizes, and curates data from various internal and external data sources. This role is pivotal to the mission and vision of Enterprise Analytics to transform healthcare for children. You must be able to architect highly scalable and reliable data engineering solutions for moving data efficiently across systems; design, implement, test and deploy data processing infrastructure; take ownership and get things done in an Agile team setting; and break down, estimate and provide just-in-time design for small increments of work.</font></font>",No experience
7,Senior Data Engineer,"<p>For more than 100 years, Seattle Children's has been leading the discovery of new cures and delivering the latest treatments available - all part of our mission to prevent, treat, and eliminate pediatric disease. We are now taking it to the next level and experiencing unprecedented growth in data and analytics across the enterprise. We're looking for talented data/analytic experts with a passion for helping kids and their families lead better, healthier lives.<br><br>Seattle Children's Enterprise Analytics (SCEA) is the analytic backbone supporting clinicians, research, and business operations. From the simplest data mart to real-time streaming for predictive analytics, we deliver data and analytics to our world-class researchers and clinicians that they need to make timely, data-driven decisions - decisions that will transform medical care and cures for kids worldwide for decades to come.<br></p>",No experience
8,senior data engineer,"ENGINEERING MapR Technologies, Inc. in San Jose, CA seeks Senior Data Engineer: Install, configure, and perform tune up of Hadoop clusters as well as analyze, design and program Big Data applications. Know the company's Hadoop stack and Hadoop Eco-System products and maintain proficiency as the technology evolves and advances. May work at other undetermined locations throughout the U.S. Telecom-muting allowed. Mail resume to MapR, Attn: HR job code #36051, 350 Holger Way, San Jose, CA 95134.",No experience
9,Data Scientist I,"Work under limited technical direction in the development of data analysis and management tools for specialized data and analytics SCH projects. The position requires skills in data science, statistics, and computer science, particularly as they apply to the analysis and management of complex biomedical and clinical data.",No experience
10,"Data Engineer, Senior","<p><strong>We are using data and analytics to transform care and cures for kids!<br></strong><br>For more than 100 years, Seattle Children's has been leading the discovery of new cures and delivering the latest treatments available - all part of our mission to prevent, treat, and eliminate pediatric disease. We are now taking it to the next level and experiencing unprecedented growth in data and analytics across the enterprise. We're looking for talented data/analytic experts with a passion for helping kids and their families lead better, healthier lives.<br><br>Seattle Children's Enterprise Analytics (SCEA) is the analytic backbone supporting clinicians, research, and business operations. From the simplest data mart to real-time streaming for predictive analytics, we deliver data and analytics to our world-class researchers and clinicians that they need to make timely, data-driven decisions - decisions that will transform medical care and cures for kids worldwide for decades to come.<br></p>",No experience
11,Data Engineer Lead,"<font size=""2""><font face=""arial,helvetica,sans-serif""><strong>We are using data and analytics to transform care and cures for kids!<br></strong><br>For more than 100 years, Seattle Children's has been leading the discovery of new cures and delivering the latest treatments available - all part of our mission to prevent, treat, and eliminate pediatric disease. We are now taking it to the next level and experiencing unprecedented growth in data and analytics across the enterprise. We're looking for talented data/analytic experts with a passion for helping kids and their families lead better, healthier lives.<br><br>Seattle Children's Enterprise Analytics (SCEA) is the analytic backbone supporting clinicians, research, and business operations. From the simplest data mart to real-time streaming for predictive analytics, we deliver data and analytics to our world-class researchers and clinicians that they need to make timely, data-driven decisions - decisions that will transform medical care and cures for kids worldwide for decades to come. <br><br></font></font><font face=""arial,helvetica,sans-serif"" size=""2""><br><br><br></font>",No experience
12,data engineer,"ENGINEERING 
	Data Engineer in Sunnyvale, California (DE-CA)  Resp for data archit., dsgn, data warehousing & quality ctrl. Enhance scalability, prfrmnce & stability of co.'s existing infrastructure. Req. BS+6. Send resume: Financial Engines, 4742 N. 24th St., Ste 270, Phoenix, AZ 85016 Attn: HSandoval/DE-CA.",No experience
13,"Data Engineer, Senior / Lead","<P><STRONG>We are using data and analytics to transform care and cures for kids!</STRONG></P><P>For more than 100 years, Seattle Children's has been leading the discovery of new cures and delivering the latest treatments available - all part of our mission to prevent, treat, and eliminate pediatric disease. We are now taking it to the next level and experiencing unprecedented growth in data and analytics across the enterprise. We're looking for talented data/analytic experts with a passion for helping kids and their families lead better, healthier lives.</P><P>Seattle Children's Enterprise Analytics (SCEA) is the analytic backbone supporting clinicians, research, and business operations. From the simplest data mart to real-time streaming for predictive analytics, we deliver data and analytics to our world-class researchers and clinicians that they need to make timely, data-driven decisions - decisions that will transform medical care and cures for kids worldwide for decades to come.<BR></P><P> </P>",No experience
14,Sr Data Scientist,"<p><strong>At Extra Space Storage, if it matters to you, it matters to us!</strong><br /> It is a really exciting time to be at Extra Space Storage! Extra Space Storage started in 1977. Between now and then, we've come a long way. Today we are a New York Stock Exchange-traded company leading the self-storage industry in more ways than one. But in order to maintain this lead, we need exceptionally motivated, capable, and driven people like you. We offer a fast-paced collaborative environment where each of us directly contributes to the company's success. Come join our growing industry and find out why so many of our employees recommend us as great place to work.<br /> <br /> We're currently hiring for a <strong>Sr. Data Scientist</strong> to work at our corporate offices in Salt Lake City, UT.  This position is instrumental in designing, developing, and fielding advanced analytics solutions that have a direct and measurable impact on Extra Space <em>Marketing</em> effectiveness. The role requires a broad knowledge of predictive analytics, optimization techniques, and creativity to invent and customize when necessary. In this position, you will demonstrate familiarity with general database structures; primary research study process flow including design, data management, and analysis; and thrive in a fast paced, deadline driven environment.</p> <p><strong>Essential Duties and Responsibilities: </strong> </p> <ul> <li>Produce success stories out of large, complicated, messy data sets. Creates recommendation engines and decision support systems that generate value</li> <li>Identify data sets (external and internal), tools, and interfaces needed to solve problems. Develops key business relationships to solve problems</li> <li>Drive key analytics capability for new customer acquisition including pricing, paid marketing, search engine marketing, social, customer feedback and response</li> <li>Monitor data collection, data processing, analysis and reporting related to testing, attribution, marketing and customer satisfaction programs</li> <li>Provide data driven insights to increase revenues, reduce CPAs, increase conversions, and increase live time value</li> <li>Develops data driven segmentation models that predict customer life time value leading to acquiring highly valuable customers</li> <li>Lead and participate in cross-function teams to establish and ensure accurate analysis methodology and reporting</li> <li>Ability to work on and negotiate multiple projects simultaneously</li> <li>Interface with external program providers and clients including Google, Adobe, Facebook, Yahoo, various content aggregators, etc. to facilitate data flow quality and provide quality analysis</li> <li>Maintain accurate project records and files</li> <li>Effectively communicate and build relationships with key partners, as well as managing client expectations</li> <li>Exhibit a high level of detail orientation and accuracy</li> <li>Demonstrate strong interpersonal/communication skills and the ability to provide superior customer service</li> <li>Exhibits excellent organizational skills and ability to work under tight deadlines with multiple tasking</li> </ul>",No experience
15,Professor of Data Science (Assistant or Associate Rank),"<p>Under the direction of the Executive Director of the <a href=""slucor.slu.edu"" target=""_blank"">Saint Louis University Center for Outcomes Research</a> (SLUCOR), the faculty member provides significant expertise and experience in the field of Data Science. The position will be responsible for developing/teaching courses, leading research, mentoring students, participating in corporate consulting, and developing academic programs.</p>",No experience
16,"Director, Data Science","Director, Data Science Peopletomysite.com, LLC dba The Shipyard seeks a Director, Data Science (#0630511) (Multiple Openings) in Columbus, Ohio to provide complex data mining and advanced analytical skills experience to our already exceptional team of professionals in the financial services industry. This is a key role in the company that will help manage and analyze statistical data to provide expert advice that yields tangible results and provides business-boosting solutions for our clients. To apply email resume to careers@theshipyard.com w/job title & job# in subject line.",No experience
17,Data Science,"Data Science Model Development Tech Lead (Berkeley Heights, NJ): Design & implement automation processes for Data Science team using SAS Grid, Revolution R & Hadoop. Automate the entire software development lifecycle. Perform application design & development. Design model automation framework. Work with software development life cycle, Python & Service Oriented Architecture. Req's Master's degr + 2yrs exp. Mail resume to AIG Employee Services, Inc., Ref# MT-AIG-171, Attn: Lisa Goldner, HR Manager, 175 Water St., NY, NY 10038. No phone calls. Web Id: 83222",No experience
18,Senior Lecturer in Computational Science and Data Science,"<p>The Harvard John A. Paulson School of Engineering and Applied Sciences (SEAS) seeks outstanding applicants for the position of Senior Lecturer in Computational Science and Data Science in the Institute for Applied Computational Science (IACS), with an expected start date of January 1, 2017.  The position is for five years and is renewable contingent upon performance, enrollments, and curricular need.</p> <p>The Senior Lecturer will have teaching responsibility for three computational or data science courses per year.  In addition, the Senior Lecturer will assist in the development and implementation of the Institute's curricular vision through collaboration with faculty partners in Computer Science, Applied Mathematics and Statistics, as well as other areas and institutes across Harvard.  The Senior Lecturer will be a member of the IACS team and have an opportunity to shape Harvard University's vision for education and research in the strategically important areas of computational and data science.  Home to a master's program in computational science and engineering, IACS is a key member of the group leading the growth and development of computational science and data science education at Harvard University.</p> <p>Duties and Responsibilities:</p> <ul> <li><strong>Teaching: </strong>teach or co-teach three graduate-level courses per year with a focus on interdisciplinary collaboration that allows students to develop problem-solving skills in computational science and data science.</li> <li><strong>Curriculum development: </strong>assist the Institute for Applied Computational Science in the continuing assessment and improvement of the Institute's curriculum in order to stay abreast of the latest developments in computational science and engineering, in particular with respect to the emerging field of data science; assist in development of computational content for existing courses across SEAS, and develop new courses as needed with a focus on hands-on, project-based classes that allow students to work collaboratively.</li> <li><strong>Student advising: </strong>serve as an intellectual mentor and advisor to students; advise master's students in their development of independent study projects and theses, develop proposals for integrated graduate training and faculty activities that provide research experiences and thesis projects for students, serve on admissions committee for master's programs; review and approve student final exams and project presentations.</li> <li><strong>Programmatic</strong>: contribute to the Institute's extracurricular program of conferences, student competitions, open houses and workshops, advising sessions, special events, and co-curricular research and academic visits, with a goal of building community, skill and knowledge in computational and data science at Harvard.</li> <li><strong>Research:</strong> conduct independent and collaborative research. Participate in the scientific and research communities in your discipline.</li> </ul>",No experience
19,DATA SCIENTIST,"DATA SCIENTIST - Capital One Services, LLC in Richmond, VA; Mult pos avail: Apply & validate stat & other math methods to collect, organize, interpret, & summarize econ data to assist in decision- making & support the dvlpmt of bus strategy. Requires a Master's degree or foreign equiv in Stat/Math/ Econ/Fin/Engn/Sci/rel quant analyt field. Must pass company's assessment. To apply, visit www.capitalone.com/careers, then search keyword ""Data Scientist"" or requisition ID R5601.",No experience
20,Data Scientists,"Data Scientists sought by Dataline Inc., in Princeton, NJ, to build statistical predictive models to identify target customers for clients; perform data extraction, processing & mining on large dbases. Req. MS or higher deg in statistics, applied math, or rltd, or equiv, 6 mths exp, demonstrated knowl of mathematical & statistical modeling, data mining, big data, applied regression, machine learning, design & analysis of data structures & algorithms, prgmg (C, C++, SQL, Python), R, SPSS, Matlab. Send CV w/ cvr ltr to: Dataline Inc., 5 Vaughn Dr., Ste. 307, Princeton, NJ 08540. Web Id: 90200",No experience
